{
  "schema": "adam.boot.contract.v1",
  "target": "canmv_k230_lp4_v3",
  "type": "vendor_boot_chain",
  "build": {
    "backend": "u_boot",
    "source": "third_party/k230-sdk/src/little/uboot",
    "source_revision": "7e302f733311d284be255f0d81d3463b6ae6ee6d",
    "arch": "riscv",
    "defconfig": "k230_canmv_v3_defconfig",
    "cross_compile_required": true,
    "toolchain": {
      "prefix": "third_party/QiMeng-TensorOp/qimeng_tensorop_C920V2/Xuantie-900-gcc-linux-5.10.4-glibc-x86_64-V2.8.1/bin/riscv64-unknown-linux-gnu-",
      "isa": "rv64imafdc",
      "abi": "lp64d",
      "gcc_sha256": "4971d857127dc405d3a90a431e9c5d01b2657fb28a4cbb05ab5f63f8be66efe8"
    },
    "python_modules": ["Crypto.Cipher", "gmssl.sm4"],
    "source_date_epoch": 0,
    "required_config": [
      "CONFIG_SPL=y",
      "CONFIG_TARGET_K230_CANMV=y",
      "CONFIG_DEFAULT_DEVICE_TREE=\"k230_canmv_v3\"",
      "CONFIG_CANMV_V3_LPDDR4_2667=y"
    ],
    "artifacts": [
      {
        "name": "spl",
        "path": "u-boot-spl-k230.bin",
        "min_bytes": 65536,
        "magic_ascii": "K230"
      },
      {
        "name": "uboot",
        "path": "fn_u-boot.img",
        "min_bytes": 131072,
        "magic_ascii": "K230"
      }
    ],
    "symbol_checks": [
      {
        "artifact": "spl/u-boot-spl",
        "required": ["ddr_init_board", "ddr_init_training"]
      }
    ]
  },
  "required_components": [
    "spl",
    "uboot"
  ],
  "required_evidence": [
    "source_revision_pass",
    "spl_build_pass",
    "ddr_init_link_pass",
    "uboot_build_pass"
  ],
  "not_claimed": [
    "This contract does not prove the image boots on K230.",
    "Board boot requires physical serial evidence after packing and flashing."
  ]
}
